Title,Price
Airox 4 in 1 Power Bank MP969 (10000mAh),"Rs. 2,999"
Airox Fast Charging Supported PD Power Bank PB-03 (20000mAh),"Rs. 3,999"
XCESS Flash I Fast Charging Power Bank (10000mAh),"Rs. 3,249"
Airox Quick Charging Power Bank AR-209 (30000mAh),"Rs. 5,499"
Airox 2 USB Port Power Bank (20000mAh),"Rs. 2,599"
Airox Fast Charging Supported PD Power Bank PB-01 (10000mAh),"Rs. 3,099"
Airox Fast Charging Supported PD Power Bank PB-02 (10000mAh),"Rs. 2,999"
Aukey PB-Y36 Sprint Go Mini Power Bank (10000mAh),"Rs. 5,349"
HOTTU Fast Charging Power Bank HTY06 (10000mAh),"Rs. 3,099"
HOTTU Fast Charging Power Bank A91 (10000mAh),"Rs. 2,549"
Redmi Power Bank (10000mAh),"Rs. 3,699"
Redmi Power Bank (20000mAh),"Rs. 5,999"
HOTTU Fast Charging Power Bank HTY15 (10000mAh),"Rs. 2,549"
Aspor A306 Power Bank 30000mAh,"Rs. 6,199"
Airox Fast Charging Supported PD Power Bank AR-989 (10000mAh),"Rs. 2,499"
Romoss WSL10 Wireless Power Bank (10000mAh),"Rs. 4,499"
Samsung Battery Pack 10000 mAh Power Bank,"Rs. 7,149"
Anker PowerCore 26800 PD Power Port III Mini Speed Combo,"Rs. 25,999"
Joyroom Mini Magnetic Power Bank JR-W020 (10000mAh),"Rs. 5,699"
Ansty AP-05 Power Bank (11200 mAh),"Rs. 2,899"
Fontec Ace Power Bank (10000mAh),"Rs. 2,349"
Joyroom Cutie Series Power Bank JR-L008 (10000mAh),"Rs. 5,249"
Realme 30W Dart Charge Power Bank (10000 mAh),"Rs. 8,999"
Joyroom Colorful Series Mini Power Bank JR-L012 (10000mAh),"Rs. 4,799"
HOTTU Fast Charging Power Bank HTY16 (20000mAh),"Rs. 3,999"
Joyroom Ultra-Fast Charging Power Bank JR-QP192 (20000mAh),"Rs. 5,399"
LOGIN LT-P30 Power Bank (20000 MAH),"Rs. 4,749"
Yolo Juice Power Bank (10000mAh),"Rs. 2,299"
Joyroom Type-C Cable 20W Power Bank JR-L001 (10000mAh),"Rs. 4,349"
Airox All In One Power Bank MP961 (10000mAh),"Rs. 3,299"
Airox All In One Power Bank MP962 (20000mAh),"Rs. 4,299"
Mi Ultra Compact Power Bank 3 (10000mAh),"Rs. 5,399"
Faster Digital Display Power Bank J12 (10000mAh),"Rs. 4,799"
HOTTU Fast Charging Power Bank A92 (20000mAh),"Rs. 3,999"
Aspor A323 Power Bank 10000 mAh,"Rs. 1,999"
